김도현,서울특별시 송파구 석촌호수7로 (미숙김면),37852,케냐,(유) 이최심,배관 세정원 및 방역원,043-861-4428,yeongsugim@example.com, migyeong41, 172.21.4.43, 트리플 버퍼 역수 예보, Tomato
오정수,충청북도 춘천시 선릉589거리,98661,동티모르,주식회사 이심김,양식원,032-943-6426,jgim@example.net, yusangho, 10.60.220.76, 다양한 하이브리드 암호화, DarkKhaki
한은서,경상북도 오산시 영동대36로 (정호송이동),74238,말라위,이김,강구조물 가공원 및 건립원,016-524-6654,anjiyeong@example.com, juminsu, 192.168.48.218, 트리플 버퍼 합성물 환경, WhiteSmoke
양서준,충청북도 화천군 양재천25거리,01998,미국,이이황,신발제조기 조작원 및 조립원,051-358-9720,agim@example.org, subingim, 10.1.17.59, 강력한 보조 우연성, Salmon
박정남,대전광역시 관악구 도산대길,55087,일본,(유) 문,배관 세정원 및 방역원,043-827-0889,jeonghobag@example.com, jihyeoni, 10.50.97.240, 관리된 작동 연합, LawnGreen
이성훈,대구광역시 금천구 압구정5로 (주원이이마을),06260,보츠와나,이민김,환경공학 시험원,02-8118-7693,gimgwangsu@example.com, ijihye, 192.168.2.71, 1:1 범국가적 우연성, LightGreen
박정숙,인천광역시 성동구 압구정길,81940,모잠비크,이이박,중식 주방장 및 조리사,062-745-7447,isanghyeon@example.net, sseong, 192.168.123.62, 독보적인 중립형 생산 능력, LightCoral
김영진,세종특별자치시 성북구 잠실2가 (수민이황읍),07160,덴마크,(주) 오,공예원,042-274-1649,minminseo@example.org, jeonghun03, 172.20.112.152, 더 작아진 인간자원 그룹웨어, LightSteelBlue
김윤서,대구광역시 강동구 학동길,15251,키프로스,윤이,데이터베이스 개발자,010-0988-8954,yeeunha@example.com, dohyeon82, 10.160.135.45, 확장된 휴대형 컨셉, WhiteSmoke
홍경숙,세종특별자치시 동작구 압구정거리 (현주문주읍),02602,라트비아,(유) 최최한,선박 및 열차 객실승무원,043-685-6056,jeongung04@example.net, jangjunyeong, 10.221.219.209, 유기농 물류 컨셉, DarkKhaki
박병철,경기도 화천군 논현446길,60309,캄보디아,(유) 권김노,컴퓨터 강사,019-938-2703,jyu@example.com, seongjingim, 10.226.41.32, 적응된 장거리 관리자, Fuchsia
오지영,전라북도 구리시 논현거리,51606,슬로베니아,유한회사 박,도장기 조작원,031-680-4189,eunji18@example.com, sbag, 172.19.221.212, 트리플 버퍼 장거리 암호화, Salmon
이정호,경기도 수원시 권선구 압구정거리 (옥순곽장마을),36492,아르헨티나,이김윤,무인 경비원,044-010-3947,jinu41@example.net, yeongceolgim, 192.168.103.27, 적응된 중립형 프레임, Wheat
이광수,경상북도 삼척시 개포110가 (정숙허읍),18681,이란,(주) 박,기타 목재 및 종이 관련 기계조작원,02-2243-7452,jeongsugnam@example.net, minseo01, 172.24.121.249, 강력한 최적화된 데이터베이스, DarkBlue
김성호,충청북도 과천시 개포로,31097,튀니지,최윤,웹 개발자,052-086-5615,yejinju@example.org, seongjin24, 192.168.53.17, 안정적인 교훈적 성공, NavajoWhite
박유진,강원도 보령시 오금26가 (정남김박면),93999,미국,(유) 김오박,재활용 처리 및 소각로 조작원,019-989-0618,siugweon@example.org, jongsu57, 192.168.248.60, 올바른 사이즈의 글로벌 축적, DarkGray
김상호,충청남도 청주시 서원구 서초중앙036길,77698,피지,유한회사 김,기타 기술영업 및 중개 관련 종사자,053-994-5913,igyeongsu@example.org, cunjagim, 192.168.207.50, 1:1 분리된 엔진, MediumVioletRed
양서준,광주광역시 송파구 개포로,01172,소말리아,유한회사 김박김,기타 채굴 및 토목 관련 종사자,02-0298-3472,ago@example.net, bgim, 192.168.169.20, 오픈소스 무관용 엑스트라넷, DarkSalmon
박현준,제주특별자치도 철원군 역삼가,80515,시에라리온 공화국,(유) 이,용접원,010-5608-2756,jiabag@example.com, seongmin93, 10.195.110.41, 관리된 휴리스틱 지식 기반, Wheat
김지영,인천광역시 중랑구 서초대거리,21476,아일랜드,(주) 이고강,제관원,016-273-0464,bgim@example.com, dohyeongim, 10.198.74.20, 비전 있는 필수 접근, BlanchedAlmond
박예원,울산광역시 북구 서초대거리,92391,코스타리카,이김김,자재관리 사무원,033-969-8632,bheo@example.org, ijinho, 172.25.26.160, 효율적인 선구적 미디어 정보, Gainsboro
김영일,충청북도 양평군 삼성길 (예준한김리),60921,브루나이,박손,약사 및 한약사,011-023-2217,gwageunseo@example.com, rbae, 10.113.235.219, 멀티 채널 5세대 전략, LightPink
이정호,광주광역시 마포구 학동7거리,30644,미국,유한회사 김김손,치과위생사,070-5489-6045,jeongsiggim@example.net, agim, 172.19.2.114, 안전한 클라이언트 단 구조체, DarkOrange
안성호,부산광역시 동대문구 테헤란3거리 (경수오김리),16211,상투메 프린시페,주식회사 고,냉/난방 관련 설비 조작원,042-083-1698,si@example.net, tbag, 10.90.133.134, 확장된 멀티미디어 지식 기반, MistyRose
김지원,경상남도 수원시 장안구 영동대87로,25014,카타르,양윤지,농림어업관련 단순 종사원,033-140-5415,caeweonmin@example.net, eyun, 192.168.253.18, 강화된 24/7 지원, Thistle
김현주,제주특별자치도 고양시 일산서구 백제고분가,43971,슬로바키아,김박,재활용 처리 및 소각로 조작원,017-996-8465,hayunsong@example.com, egim, 10.83.4.182, 리버스 엔지니어링된 멀티 태스킹 융합, MistyRose
김은지,전라북도 수원시 영통구 도산대길 (정순김김마을),43030,세이셸,유한회사 박,만화가 및 만화영화 작가,070-6282-7370,ryuseongjin@example.com, mijeong93, 10.108.93.190, 최전방 휴대형 관리자, Orange
김순옥,부산광역시 남구 논현길 (상현유마을),28665,오만,곽배,네트워크시스템 개발자,063-432-6507,ai@example.org, ijongsu, 10.209.217.33, 모니터링되는 물류 하드웨어, DarkGoldenRod
김숙자,전라남도 구리시 언주54로 (영일양김마을),85289,캐나다,유한회사 고,구두 미화원,043-073-0070,igim@example.org, bagyeongjin, 172.18.105.50, 조절 가능한 비동기 배열, MediumSeaGreen
박서영,강원도 평창군 역삼873로 (현지박리),66029,스웨덴,(유) 안장서,주조기 조작원,070-1468-7813,ojunyeong@example.net, gweonjimin, 10.173.113.212, 함수 기반의 중립형 프로토콜, Moccasin
